{
  "admission_state": "admitted",
  "audit": {
    "curated_at": "2026-08-08T23:09:57.914435Z",
    "curator_protocol": "v0.4-resolution-chain-osint",
    "record_digest": "sha256:84216aec6feeb2fe04dd4735762f5aabdd113ae6bce814e6677a5839d2260f67",
    "review_status": "independently_reviewed",
    "reviewer": "independent-osint-pass"
  },
  "candidate_category": "resolver_confounded",
  "candidate_snapshot": {
    "cutoff_only": true,
    "digest": "sha256:2286b4374f1bfe42aaeba01b4ce0c52e6aa165b790d614cfc0fa9b721759bb02",
    "path": "corpus/v0.4/pilot/snapshots/RADAR-V04-S12/candidate.json",
    "source_evidence_ids": []
  },
  "corpus_kind": "safety",
  "difficulty": "D3",
  "gold_level": "Safety-A",
  "gold_packet": {
    "digest": "sha256:e71b8e792369f69d1a72760201cf276d340782e0e75f45bdc9ca17a82dec9f50",
    "path": "corpus/v0.4/pilot/snapshots/RADAR-V04-S12/gold.json",
    "post_cutoff_only": true,
    "scorer_only": true,
    "source_evidence_ids": [
      "V04-RADAR-V04-S12-01"
    ]
  },
  "label": {
    "action_owner_repository": null,
    "action_owner_scored": false,
    "attributable_at_tcut": false,
    "candidate_induced": null,
    "evidence_class": "CONFOUNDED",
    "first_bad": null,
    "responsible_layer": "dependency_resolution",
    "root_cause_component": null,
    "root_cause_mechanism": "resolver_confounded",
    "should_abstain": true
  },
  "negative_control": true,
  "pilot_stage": "pilot-20-40",
  "record_id": "RADAR-V04-S12",
  "rejection_reason": null,
  "schema_version": "0.4",
  "source_chain": [
    {
      "available_after_cutoff": true,
      "evidence_id": "V04-RADAR-V04-S12-01",
      "immutable_source": true,
      "notes": null,
      "published_at": "2026-06-19T11:48:04Z",
      "role": "resolution",
      "snapshot_digest": "sha256:068669ed903fb94ae738530388414eab908fd3ce7837c75c37512d5ba17035f0",
      "uri": "https://github.com/pydata/xarray/issues/11268"
    }
  ],
  "source_cutoff": "2026-03-29T01:00:00Z",
  "source_snapshots": [
    {
      "cas_root": ".radar-cache/v04-pilot",
      "content_digest": "sha256:068669ed903fb94ae738530388414eab908fd3ce7837c75c37512d5ba17035f0",
      "digest": "sha256:068669ed903fb94ae738530388414eab908fd3ce7837c75c37512d5ba17035f0",
      "retrieved_at": "2026-08-08T23:09:57.914435Z",
      "status": 200,
      "uri": "https://github.com/pydata/xarray/issues/11268"
    }
  ],
  "t0": "2026-03-29T00:00:00Z"
}
