{
  "admission_state": "admitted",
  "audit": {
    "curated_at": "2026-08-08T23:09:57.914435Z",
    "curator_protocol": "v0.4-resolution-chain-osint",
    "record_digest": "sha256:0f8f6b45548af4c75a321e4d1180b4259c8aff75e97a1cd0af570d58cabefb8b",
    "review_status": "independently_reviewed",
    "reviewer": "independent-osint-pass"
  },
  "candidate_category": "ci_or_infrastructure",
  "candidate_snapshot": {
    "cutoff_only": true,
    "digest": "sha256:73a1de7ef083e39acdcc56770e6aa7b9a0705b5476ff3d69ca89e2892d86f6fc",
    "path": "corpus/v0.4/pilot/snapshots/RADAR-V04-S32/candidate.json",
    "source_evidence_ids": []
  },
  "corpus_kind": "safety",
  "difficulty": "D5",
  "gold_level": "Safety-A",
  "gold_packet": {
    "digest": "sha256:ac9a3a34974572a7046c8145e5946899b886a314b64aaf1f44c845c7f3e50db8",
    "path": "corpus/v0.4/pilot/snapshots/RADAR-V04-S32/gold.json",
    "post_cutoff_only": true,
    "scorer_only": true,
    "source_evidence_ids": [
      "V04-RADAR-V04-S32-01"
    ]
  },
  "label": {
    "action_owner_repository": null,
    "action_owner_scored": false,
    "attributable_at_tcut": false,
    "candidate_induced": null,
    "evidence_class": "CONFOUNDED",
    "first_bad": null,
    "responsible_layer": "ci_or_infrastructure",
    "root_cause_component": null,
    "root_cause_mechanism": "ci_or_infrastructure",
    "should_abstain": true
  },
  "negative_control": true,
  "pilot_stage": "pilot-20-40",
  "record_id": "RADAR-V04-S32",
  "rejection_reason": null,
  "schema_version": "0.4",
  "source_chain": [
    {
      "available_after_cutoff": true,
      "evidence_id": "V04-RADAR-V04-S32-01",
      "immutable_source": true,
      "notes": null,
      "published_at": "2026-01-27T14:00:00Z",
      "role": "infrastructure_signal",
      "snapshot_digest": "sha256:1e25e6d07b4f4def97882bc5efb070b5170fd96e7bd0678be5aa2f6b19eb4c0f",
      "uri": "https://github.com/scipy/scipy/issues/24444"
    }
  ],
  "source_cutoff": "2026-01-27T01:00:00Z",
  "source_snapshots": [
    {
      "cas_root": ".radar-cache/v04-pilot",
      "content_digest": "sha256:1e25e6d07b4f4def97882bc5efb070b5170fd96e7bd0678be5aa2f6b19eb4c0f",
      "digest": "sha256:1e25e6d07b4f4def97882bc5efb070b5170fd96e7bd0678be5aa2f6b19eb4c0f",
      "retrieved_at": "2026-08-08T23:09:57.914435Z",
      "status": 200,
      "uri": "https://github.com/scipy/scipy/issues/24444"
    }
  ],
  "t0": "2026-01-27T00:00:00Z"
}
